id,question
191,What types of transportation options will be available to me when traveling in Copenhagen?
192,"What are the coordinates of the location I am planning to visit in Cartagena, Colombia?"
192,What months of the year are recommended for visiting Cartagena for sightseeing?
192,What kind of local cuisine should I expect to find when I travel to Cartagena?
192,What modes of public transportation can I use when navigating the city of Cartagena?
192,"What historical sites or cultural activities can I explore while I am visiting Cartagena, Colombia?"
193,"What are some popular attractions I should visit when I travel to Prague, Czech Republic?"
193,I'm planning to visit Prague - what's the most iconic landmark I shouldn't miss?
193,What are the best transportation options available to get around the city?
193,What's the recommended time to visit Prague to enjoy pleasant weather?
193,"What type of local food or cuisine should I try when I get to Prague, Czech Republic?"
194,"What is the name of the famous palace in Split, Croatia that I should not miss?"
194,What months of the year are best for visiting Split to enjoy the beach?
194,What are the two popular types of transportation available in Split?
194,What are some must-try dishes that showcase the local cuisine of Split?
194,"What are the geographic coordinates of Split, Croatia?"
195,What time of the year is best for visiting Accra to enjoy the festivals and local music scene?
195,"Can you please suggest some local dishes to try when I visit Accra, Ghana?"
195,What are some popular tourist attractions that I should not miss when I travel to Accra?
195,What mode of transportation can I expect to use to travel around the city of Accra?
195,"What kind of cultural experiences can I expect to have in Accra, Ghana, and what kind of events are available?"
196,"What is the best time of year to visit Nassau, Bahamas to ensure a pleasant stay?"
196,"Are there any local transportation options available for tourists in Nassau, Bahamas?"
196,"What are the names of some beaches in Nassau, Bahamas that are known for being stunning and relaxing?"
196,"Can I use US dollars everywhere I go in Nassau, Bahamas, or is the local currency different?"
196,"What type of food dishes should I expect to find in local restaurants during my stay in Nassau, Bahamas?"
197,"What are the major attractions I should consider visiting when I travel to Tunis, Tunisia?"
197,What are the most convenient modes of public transportation available in Tunis?
197,What is the significance of the Medina in Tunis and what should I look out for when I visit?
197,I am interested in learning more about local Tunisian food. Can you list some must try dishes when I visit?
197,"What is the ideal time to plan my visit to Tunis, considering factors like climate and tourist season?"
198,What months are recommended for visiting Zanzibar to ensure good weather?
198,Are there any local food specialties that I should try while visiting Zanzibar?
198,What type of transportation can I use to get around Zanzibar?
198,Can I easily communicate in English while visiting Zanzibar?
198,What kind of attractions can I typically find in or near Stone Town?
199,"What months of the year are considered the best time to visit Catania, Italy?"
199,What traditional Sicilian treats can I expect to find in Catania's local markets?
199,"How do I get around Catania, and what transportation options are available?"
199,"What are the cultural highlights that Catania is known for, and how can I experience them?"
199,"What popular attractions should I visit while in Catania, Italy?"
200,"What are the popular spots for relaxation in Fortaleza, Brazil?"
200,In what months does Fortaleza have the most vibrant nightlife?
200,"What types of food should I try when visiting Fortaleza, Brazil?"
200,Are there any specific events I should attend when visiting Fortaleza?
200,"What mode of public transportation is available in Fortaleza, Brazil?"
201,"What are the local foods I should try when visiting Maseru, Lesotho?"
201,"What options do I have for getting around Maseru, Lesotho?"
201,"What are some popular attractions to visit when in Maseru, Lesotho?"
201,"What outdoor activities can I participate in during my visit to Maseru, Lesotho?"
201,"What are the two main languages spoken by locals in Maseru, Lesotho?"
202,What is a must-see tourist attraction in Osaka that combines local culture and amusement?
202,"What time of the year is best for tourists to visit Osaka, considering the season and weather?"
202,In what type of setting can I experience and savor local food specialties in Osaka?
202,What are my travel options for getting around Osaka once I arrive?
202,Are there any local customs or cultural events that I should be aware of to blend in with the locals?
203,What is the recommended time of the year to visit Luanda for good weather?
203,What local dishes should I try while visiting Luanda?
203,What are some popular tourist attractions to visit in Luanda?
203,What modes of transportation are available in Luanda for getting around?
203,What cultural activities can I participate in while visiting Luanda?
204,What months of the year are considered the best time to visit Nairobi?
204,Where can I experience the wildlife of Nairobi?
204,What local foods should I try during my stay in Nairobi?
204,Is there more than one language spoken in Nairobi and what are they?
204,What type of tours are available in Nairobi for those interested in understanding the culture?
205,"What are some popular attractions I shouldn't miss when visiting Lima, Peru?"
205,When is the best time to visit Lima to get the most out of my trip?
205,"I'm looking for a great cultural experience, what activities are available in Lima?"
205,What are some highly recommended local dishes I should try while in Lima?
205,What is the primary mode of public transportation used by locals in Lima?
206,What local markets would you recommend visiting to experience the local cuisine and crafts?
206,Are there any unique activities that incorporate the local culture?
206,Can you provide information on the best times to take a cultural tour in Nairobi?
206,What are the local specialties for street food or snacks?
206,Are there any notable wildlife conservation centers that I can visit?
207,"What are some popular local dishes to try while visiting Abidjan, Ivory Coast?"
207,When is the best time of the year to plan a trip to Abidjan and experience its vibrant culture?
207,Are there any specific festivals or events that I should consider visiting for a more immersive experience?
207,What kind of transportation options are available to get around the city?
207,Can I expect to see any historical landmarks or architectural icons while exploring Abidjan?
208,What are the popular attractions I can visit when I travel to the destination?
208,What time of year is best for visiting my destination city?
208,"I'd like to immerse myself in the culture, what are some cultural highlights I can experience?"
208,What are the best modes of transportation available in the destination city?
208,What are some delicious local food items I should try when I am at my destination?
209,What months of the year would be ideal for visiting Khartoum in terms of the weather?
209,What are some of the unique cultural experiences I can expect to have in Khartoum?
209,What local dish containing fava beans should I not miss trying in Khartoum?
209,What body of water is divided at a location that I should definitely visit while in Khartoum?
209,What is a common way for visitors to get around the city of Khartoum?
210,What time of year should I plan my trip to Harare to have the best experience?
210,"Are there any local dishes I should try when I'm in Harare, Zimbabwe?"
210,What types of public transportation are available to get around Harare?
210,Are there any specific cultural events or activities that I shouldn't miss in Harare?
210,What languages should I expect to hear spoken during my trip to Harare?
211,What type of nights is recommended to visit for dancing in Buenos Aires?
211,"What is a can't-miss experience according to the user review for Buenos Aires, Argentina?"
211,"What are the months of the year when it is recommended to visit Buenos Aires, Argentina?"
211,"What options are available for tourists who want to navigate Buenos Aires, Argentina using public transportation?"
211,"What type of tours are available for tourists who want to experience the culture of Buenos Aires, Argentina?"
212,"I'm planning a trip to Lisbon, what are the must-visit attractions for a first-timer?"
212,Can you recommend the unique local cuisine I should try when visiting Lisbon?
212,What is the best way to get around Lisbon once I arrive?
212,"I'm interested in learning about Lisbon's cultural aspects, what are some highlights I should know about?"
212,"If I prefer a mix of good weather and smaller crowds, when should I plan my trip to Lisbon?"
213,"What are some must-visit places to see when I travel to Athens, Greece?"
213,What time of the year should I avoid visiting Athens to escape the peak tourist season?
213,What are the local dishes I should definitely try while in Athens?
213,"What options do I have for getting around Athens, especially from one popular attraction to another?"
213,What are some cultural experiences or activities I can enjoy while in Athens?
214,What are the must-visit attractions in Yangon during cultural tours?
214,When is the best time to visit Yangon to experience the local festivals?
214,"What are the primary languages spoken by the locals in Yangon, Myanmar?"
214,What are the popular local dishes that visitors to Yangon should try?
214,What are the different transportation options available to travel within Yangon?
215,What are the best months to visit doha for optimal weather?
215,What popular museums can i find in doha?
215,"I'm visiting doha in May, what tip can you provide for this time?"
215,Are there any ancient cultural heritage sites to explore in doha?
215,What public transportation options are available from the airport?
