id,question
130,Can you describe some popular dishes that I can try while I'm in Havana?
130,What are some popular sites and attractions that I should visit during my trip to Havana?
131,"What are the local markets in Khartoum like, and what can I expect to experience when I visit them?"
131,What is the significance of the confluence of two rivers in the area?
131,What types of dishes should I try when sampling the local cuisine?
131,How do I get around the city once I arrive?
131,What time of the year has the best weather conditions for exploring the local attractions?
132,"What are the popular transportation options in Dhaka, Bangladesh?"
132,Could you provide the best time frame to plan a trip to see the rickshaw art in Dhaka?
132,"What are the must-try local cuisine when visiting Dhaka, Bangladesh?"
132,"Are there any historical sites to explore while visiting Dhaka, and what are they?"
132,"What languages can I expect to hear or use while traveling in Dhaka, Bangladesh?"
133,What attractions should I visit in Nassau to make the most of my trip?
133,"Are there any specific events or festivals I should plan my visit around in Nassau, Bahamas?"
133,What are some unique souvenirs that I can bring back from Nassau?
133,"What kind of meals can I expect to find in Nassau, and are there any local specialties?"
133,I plan to travel to Nassau in August. Is the weather favorable for outdoor activities?
134,"When is the recommended time to visit the destination of Doha, Qatar?"
134,"Which locations in Doha, Qatar would be suitable for dining near the water?"
134,"What types of events are available for tourists to experience in the destination of Doha, Qatar?"
134,"In Doha, Qatar, what are some examples of notable local dishes to try?"
134,"What type of buildings or structures are a prominent aspect of Qatari culture in Doha, Qatar?"
135,What are some top attractions to visit while I'm in Cairo?
135,"What type of cuisine should I be prepared to eat while I'm in Cairo, Egypt?"
135,What are my options to get around the city of Cairo?
135,Are there any specific activities that I can participate in along the Nile River?
135,What month would be a good time to visit Cairo if I want to avoid the heat and experience good weather?
136,"What are the coordinates to help me find the exact location of Windhoek, Namibia?"
136,"What is the most ideal time of the year for a visit to Windhoek, Namibia?"
136,Are there any museums that I can visit to learn about Namibia's history in Windhoek?
136,What types of dishes should I try when I'm trying the local cuisine of Windhoek?
136,"Are there other languages spoken in Windhoek, apart from English?"
137,"What time of the year offers the most pleasant weather in Tbilisi, Georgia?"
137,What are some must-try local dishes when visiting Tbilisi?
137,What are the primary modes of public transportation available in Tbilisi?
137,What are some of the top attractions to visit in Tbilisi for historical and cultural significance?
137,What activities can I participate in to experience the unique traditions and scenic views of Tbilisi?
138,"What are the geographical coordinates of Sucre, Bolivia?"
138,Could you help me find the best time to explore Sucre's colonial architecture?
138,"What local food items would you recommend trying when visiting Sucre, Bolivia?"
138,What are some ways I can get around the city once I arrive in Sucre?
138,What are the two popular historical places I shouldn't miss when visiting Sucre?
139,"What are the top local dishes I should try while visiting Batumi, Georgia?"
139,What is the weather like during the best time to visit Batumi?
139,What are the notable landmarks along the coastline in Batumi?
139,What modes of public transportation are available in Batumi?
139,What type of events can I attend in Batumi aside from beach activities?
140,"What are the popular attractions I shouldn't miss when traveling to Accra, Ghana?"
140,What are the months with the best weather to visit Accra?
140,What local dishes should I try when visiting Accra?
140,What are some of the cultural experiences I can have in Accra?
140,How can I get around the city of Accra?
141,What are the famous modes of local transportation in Lisbon?
141,Can you recommend any popular historical sites in the city of Lisbon?
141,"I am planning to travel to Lisbon in November, is the weather still pleasant?"
141,What are some traditional Portuguese food I should try when I am in Lisbon?
141,"I am looking for activities that showcase Lisbon's historic landmarks, what options are available?"
142,"What are some must-try dishes when visiting Maseru, Lesotho?"
142,What are the coordinates for mapping the location of Maseru in Lesotho?
142,What is the best season for hiking in Maseru and what months does it cover?
142,What are some popular scenic attractions to explore in Maseru?
142,What types of guided excursions can tourists participate in while in Maseru?
143,What are some must-visit historical sites in Tunis?
143,How would you describe the local culture in the city?
143,What type of transportation is most convenient in Tunis?
143,Can you name a dish that I should try while visiting?
143,What are the best months to explore Tunis and why?
144,What is notable about the Kasbah in Algiers?
144,What months are recommended to visit Algiers?
144,What can I experience by walking through Algiers' narrow streets?
144,Are there religious architectural landmarks to see in Algiers?
144,What are some types of guided tour options available in Algiers?
145,What are some attractions that I should consider visiting when in Zimbabwe's capital city?
145,What are the top recommended months to visit Harare for the best experience?
145,"How can I get around the city once I arrive, and what are the local transportation options available?"
145,"What are some unique dishes that I should try while in Harare, and what are they known for?"
145,What are some activities that I can participate in to fully immerse myself in the local culture and learn more about it?
146,"What is the name of the square that I should definitely visit in Samarkand, Uzbekistan, and at what time of day is recommended for touring?"
146,"Are there any month or season recommendations for a trip to Samarkand, Uzbekistan?"
146,What are some must-try dishes of the local cuisine in Samarkand?
146,"What are my choices for transportation options once I arrive in Samarkand, Uzbekistan?"
146,What historical sites or other activities are available during my visit to Samarkand?
147,What time of the year is best to visit the city?
147,What foods should I try when I'm in the city for a taste of local cuisine?
147,What language do most people speak in the city?
147,Can I use public transportation options such as buses and metro lines to navigate the city?
147,What kind of events and tours can I participate in when I'm in the city?
148,What are the vibrant aspects of Asunción's nightlife?
148,What are some local dishes I should try when I visit Asunción?
148,What time of the year is best to visit Asunción for a great experience?
148,What are the names of the local dishes I should try at restaurants in Asunción?
148,What transportation options are available to get around Asunción?
149,What should I prioritize when visiting Nairobi National Park to see wildlife?
149,Is there a specific month range recommended for traveling to Nairobi?
149,What are some local dishes I should expect to find during my visit to Nairobi?
149,Are there any popular spots for interacting with or learning about wildlife in Nairobi?
149,Are there multiple transportation options available throughout Nairobi?
150,"What are the top two must-see attractions in Siem Reap, Cambodia based on popular reviews?"
150,Are there any specific months in the year that are considered the best time to plan a visit to Siem Reap?
150,"I am interested in local cuisine, what traditional dishes are a must-try in Siem Reap?"
150,What form of local transportation can I expect to use frequently during my visit to Siem Reap?
150,Are there any specific tips or recommendations to minimize crowd presence while visiting Siem Reap's popular sites?
151,"What are some must-try local food items when I visit Ankara, Turkey?"
151,What time of the year is ideal for visiting Ankara in terms of the weather?
151,"How do I get around the city once I'm in Ankara, Turkey?"
151,"I'm interested in exploring historical places, what popular attractions should I look out for in Ankara?"
151,"What type of activities can I expect to be available when I visit Ankara, Turkey?"
152,What time of year is recommended to visit Helsinki for optimal weather conditions?
152,What are some popular food items that reflect Helsinki's local cuisine?
152,What languages can I expect to hear locals speaking in Helsinki?
152,What types of activities are available for tourists to enjoy in Helsinki?
152,What are some popular landmarks or sites that I should consider visiting in Helsinki?
153,What is the best period of the year to plan a visit to Kinshasa?
153,What are some popular local dishes that I should try when I visit Kinshasa?
153,Are there any tips for exploring the local markets and what can I find there?
153,What are some of the must-visit places to explore the arts and culture scene in Kinshasa?
153,What modes of transportation are commonly used in Kinshasa to get around?
154,What are some outdoor activities I can do when I visit Vancouver?
154,"What is the best time of the year to visit Vancouver, Canada?"
154,What are the local foods that I should try when I am in Vancouver?
154,"How can I get around the city, what are my transportation options in Vancouver?"
154,What are some must-see places to include in my Vancouver travel itinerary?
155,What is a great time to visit the city's attractions to make the most of the natural lighting?
155,Which are the popular dish I must try while I am in the city?
155,What mode of transportation should I take to move around the city?
155,What are some of the historical sites to explore in the city?
155,Are there available cultural tours in the city that I can join?
156,"What is the best way to experience the stunning views from Table Mountain in Cape Town, South Africa?"
156,What are some of the unique South African dishes I should try when visiting Cape Town?
156,What months of the year are recommended to visit Cape Town for the best experience?
156,"What type of public transportation can I expect to find in Cape Town, South Africa?"
156,What are some popular activities to engage with the local culture and natural environment in Cape Town?
157,What time of year should I plan to visit Munich to attend the famous cultural event mentioned in the review?
157,What are the names of some types of food that I should look to try during my trip?
157,How can I get around the city once I have arrived in Munich?
157,What are some activities that I can participate in during my trip to Munich?
157,Are there any famous landmarks that I should plan to visit during my trip?
158,What are some popular attractions to visit in Honolulu?
158,What is the best time of year to visit Honolulu for optimal weather?
158,Can you recommend any local cuisine that I should try while in Honolulu?
158,What are the primary transportation options available for getting around Honolulu?
158,Are there any specific language requirements or dialects that I should be aware of before visiting Honolulu?
159,What are the months during which Brasilia has the best weather for visiting?
159,Can you recommend a unique way to experience the city's attractions?
159,What are some landmarks in Brasilia that showcase its cultural significance?
159,"Do I need to speak English to navigate Brasilia, or is another language more commonly used?"
159,What are some local dishes that I should definitely try when visiting Brasilia?
160,"What parts of Tunis, Tunisia, have been recognized by UNESCO?"
160,"Besides visiting museums and historical sites, what other activities can I do in Tunis?"
160,What kinds of food can I expect to find when trying the local cuisine of Tunis?
160,"I'm planning a trip to Tunis and I want to make the most of it. When is the best time to visit this destination, considering factors that influence travel such as weather?"
160,Are there any local markets or shopping areas in Tunis that I should look out for to find some unique souvenirs?
161,"What kind of food can I expect to find when visiting la paz, bolivia?"
161,What time of the year is best to visit la paz?
161,How do I acclimatize to high altitude when visiting la paz?
161,Can I use english when communicating with locals in la paz?
161,"What are some popular things to do when I visit la paz, bolivia?"
162,What time of year can I witness the famous cherry blossom season in my desired destination?
162,"I'm particularly excited about trying local dishes, are sushi and ramen must-try foods around there?"
162,Trying to get the best views of the city - is Tokyo Tower indeed a significant spot?
162,"Understanding that Japanese may be the primary spoken language, can I still easily communicate in English?"
162,"Considering I've planned my trip, what available public transportation options can I rely on in the city?"
163,What is the best way to explore the city of Georgetown in Malaysia?
163,Could you recommend the best months to plan a trip to experience the city's vibrant culture?
163,What local dishes should I definitely try when visiting Georgetown?
163,Are there any alternative transportation options available other than buses and trains in Georgetown?
163,What are the primary languages spoken by locals in Georgetown that tourists should be aware of?
164,"What are some unique things to experience while visiting Stockholm, Sweden?"
164,Which time of the year is best to visit Stockholm to enjoy its stunning natural scenery?
164,"Can I get around the city using public transportation, and if so, what options are available?"
164,What are some iconic dishes I need to try while visiting Stockholm?
164,What are some must-see attractions I should prioritize during my visit to Stockholm?
165,What time of year is best to visit Tbilisi if I want to avoid extreme weather?
165,What type of attractions can I expect to see when I visit Old Tbilisi?
165,Are there any unique dishes I should try while I'm in Tbilisi?
165,Can I get around Tbilisi using the public transportation system?
165,Are there any specific activities available in Tbilisi that focus on local traditions?
166,"What are the top two local dishes I should try when visiting Yangon, Myanmar?"
166,Can you recommend the best time of day to visit the Shwedagon Pagoda?
166,What are the options for getting around Yangon besides walking?
166,"What months of the year would be the best time to plan my trip to Yangon, Myanmar?"
166,What are some activity options for visitors who are interested in learning more about Yangon's history?
167,What time of the year is recommended to visit to enjoy outdoor activities in Malmo?
167,Can you tell me what type of architectural styles can be seen in Malmo's popular buildings?
167,What are some common food items one can expect to find in Swedish restaurants in Malmo?
167,"How do I get around the city using public transportation in Malmo, Sweden?"
167,What types of leisure activities are available for tourists to enjoy at the popular Ribersborgsstranden?
168,"What are the top recommended dishes to try when visiting Lima, Peru?"
168,"Can I use public transportation to get around Lima, and what options are available?"
168,I'm interested in exploring the local culture. Are there any specific months that are ideal for visiting Lima?
168,What are some of the must-visit attractions that I should add to my itinerary when traveling to Lima?
168,Are there any guided activities available in Lima that focus on exploring the local food scene?
169,"What are some of the must-see attractions to visit while traveling in Oslo, Norway?"
169,I'm interested in trying the local cuisine of Oslo; can you provide some information on traditional Norwegian dishes?
169,"What form of public transportation can I expect to find in Oslo, Norway?"
169,I'm wondering about the city's outdoor recreational opportunities; are there any exciting activities available to visitors of Oslo?
169,"What is the best time of the year to plan a trip to Oslo, Norway, in order to make the most of my visit?"
170,What is the best way to experience the local culture in Guadalajara?
170,What festivals can I attend during my visit from October to March?
170,Can I get by without speaking Spanish during my trip?
170,What popular attractions can I visit to learn more about the rich heritage of Guadalajara?
170,What transportation options are available for me to get around Guadalajara?
171,"What is a highly recommended local dish to try when visiting Panama City, Panama?"
171,I'm planning to visit Panama City in June. Is this a good time of the year to travel to the city?
171,"How can I travel within Panama City, and what types of public transportation are available?"
171,What is the name of the part of the Panama Canal that offers the best views for visitors?
171,"What is the primary language spoken in Panama City, and will I need a translator guide to navigate the city?"
172,What are the geographical coordinates of my destination?
172,Can you recommend any cultural activities to participate in?
172,What are the popular sights that I shouldn't miss during my visit?
172,What is the primary spice used in the local cuisine of my destination?
172,What are the options available for getting around the city?
173,"What months of the year are best to visit Harare, Zimbabwe?"
173,What local transportation options are available for tourists in Harare?
173,"What kind of food can I expect to find in Harare, and are there any must-try dishes?"
173,What types of activities can I participate in while visiting Harare?
173,What kind of markets or shopping destinations are recommended for tourists in Harare?
174,"What are the highlights of local cuisine when traveling to Beirut, Lebanon?"
174,What is the best time of the year for a visit to Beirut?
174,What types of transportation can I use while exploring Beirut?
174,What are some popular attractions that I should not miss while visiting Beirut?
174,What are some activities or experiences that I can look forward to in Beirut?
175,When is the best time to plan a trip to Montevideo to experience the vibrant celebrations?
175,I've heard great things about the food in Uruguay - what are some must-try dishes when visiting Montevideo?
175,I'm looking for something historic to visit in the city - are there any popular attractions I shouldn't miss?
175,What are some fun activities that allow me to immerse myself in the local culture of Montevideo?
175,How do people typically get around the city - what are the most popular transportation options available?
176,"What are some recommended activities to enjoy the stunning landscapes in Nuuk, Greenland?"
176,Can you suggest the best time of the year to explore the fjords in Nuuk?
176,"How can I travel around Nuuk, Greenland using public transportation options?"
176,What local delicious dishes can I expect to try during my visit to Nuuk?
176,Are there any museums or cultural institutions in Nuuk where I can learn more about the local history and culture?
177,"What time of the year is best to plan my trip to Accra, Ghana?"
177,Can you tell me some famous attractions I should visit during my trip to Accra?
177,What are some cultural activities that I can experience when I visit Accra?
177,"Are there English speakers in Accra, Ghana, or do I need to learn another language?"
177,What kind of local food should I try during my stay in Accra?
178,"What are the most popular outdoor activities that I can do in Vladivostok, Russia?"
178,"I'm planning a trip to Vladivostok, are there any must-try dishes of the local cuisine that I shouldn't miss?"
178,"I'm not sure when to visit Vladivostok, could you tell me what time of the year has the best weather?"
178,"I've heard the views in Vladivostok are beautiful, what are some of the top attractions that offer great scenic views?"
178,"I'm looking for ways to get around Vladivostok, what public transportation options are available in the city?"
179,"What are the must-try local dishes when I visit Astana, Kazakhstan?"
179,What is the best time of the year to experience the local cultural festivals in Astana?
179,"What architectural features can I expect to see in Astana, Kazakhstan?"
179,What transportation options will be available to me when I arrive in Astana?
179,What activities can I participate in to learn more about the city's cultural heritage?
180,What are the top recommended activities to participate in for a memorable experience in Tbilisi?
180,"What types of transportation can I use to get around Tbilisi, especially when visiting popular tourist sites?"
180,What are some popular cultural highlights and traditions I should know about before visiting the city?
180,What are some must-try foods I should look out for when sampling the local Georgian cuisine in Tbilisi?
180,What is the best time of the year to plan a trip to Tbilisi for optimal travel conditions?
181,What month is recommended to plan a visit to Quebec City for the best experience?
181,Can you tell me about some must-try foods when I am in Quebec City?
181,How do people usually commute within Quebec City?
181,What are some of the top attractions I should consider visiting in Quebec City?
181,Can you tell me about some events I can look forward to in Quebec City during my visit?
182,What time of the year is it best to visit Vilnius?
182,What are the local cuisine highlights that Vilnius has to offer?
182,Are there any exciting UNESCO World Heritage sites in Vilnius?
182,Can you tell me the popular attractions I should not miss in Vilnius?
182,What type of transportation options are available in Vilnius city?
183,"What are some popular attractions I can visit in Zurich, Switzerland?"
183,Which months offer the best weather for visiting this city in the summer?
183,How can I get around the city using public transportation?
183,Are there any local dishes I should try while visiting this destination?
183,What are some popular activities that I can participate in while in Zurich?
184,What months are best for visiting Auckland in terms of outdoor activities?
184,What attractions are 'must-visit' for first-time travelers to Auckland?
184,How do I get to Waiheke Island from Auckland city center?
184,Are there any unique or special foods I should try during my visit to Auckland?
184,What are the other official language spoken in Auckland besides English?
185,"What are the best places to visit in Lilongwe, Malawi, to experience its local culture?"
185,How can I travel around Lilongwe and what transportation options are available?
185,What traditional Malawian dishes can I try at local food stalls in Lilongwe?
185,What are the best months to visit Lilongwe for the most enjoyable weather?
185,How many languages can I expect to hear spoken by locals during my trip to Lilongwe?
186,What are some of the popular attractions I should check out during my visit to the destination?
186,"What can you tell me about local food, is Dolma something I will find often in local markets?"
186,What is the range of months that are best to travel to the destination?
186,What type of transportation options will I have once I arrive at the destination?
186,"Is English widely spoken, or are there other languages I should know to communicate effectively in the region?"
187,"What is the best time of the year to visit Jaipur, India, considering the weather?"
187,What are the popular palaces and historical sites that I can expect to visit in Jaipur?
187,"What types of local cuisine can I experience when I travel to Jaipur, India?"
187,What modes of public transportation can I use to get around the city of Jaipur?
187,"What types of cultural activities can I expect to participate in when I visit Jaipur, India?"
188,"Can you recommend any popular attractions to visit in Wellington, and what are some of the unique sights to expect?"
188,"What kind of food experiences should I expect while traveling to Wellington, New Zealand, and what local dishes are a must-try?"
188,"I'm planning a trip to New Zealand and I'd like to know the best time of year to visit Wellington, are there specific months or seasons I should aim for?"
188,"What kind of cultural experiences can I expect in Wellington in terms of art and scenic views, and what activities can I take part in to explore these aspects?"
188,"What are some essential transportation options to get around Wellington, and will I need to learn any specific language to get by while I'm there?"
189,What are the best months to visit this city in South Korea?
189,What are the typical food options available at Gwangjang Market?
189,What is the name of the palace that is one of the city's most popular tourist attractions?
189,How would you describe the overall atmosphere of this city?
189,What type of transportation options are commonly used to get around this city?
190,"What is the dry season in Freetown, and when is the best time to visit?"
190,What are some of the local dishes I should try when I visit Freetown?
190,"What kind of activities can I participate in on the beaches of Freetown, Sierra Leone?"
190,I'm planning to travel to Freetown. Which mode of transportation will I likely be using?
190,What is the geographical location of Freetown in terms of latitude and longitude?
191,"What is the best time of year to visit Copenhagen, Denmark?"
191,What are some of the most popular places to visit in Copenhagen?
191,"What languages can I expect to hear spoken in Copenhagen, and will English be widely understood?"
191,What kind of local food can I expect to try when visiting Copenhagen?
