id,question
66,"Can I expect to try some local specialties while traveling there, and if so, what are they?"
66,How do locals typically greet and welcome tourists given the cultural highlights of this destination?
66,"Are there any celebrations I can look forward to, and what's the atmosphere like during these events?"
66,I'm worried about getting around; are there taxis readily available and how do people usually travel?
67,What are some traditional dishes I should try when visiting Serbia?
67,What attraction should I visit to see historical landmarks?
67,"I'm planning my trip to Serbia, when is the best time of the year to go?"
67,What area of Belgrade has a bohemian vibe and what can I do there?
67,How can I get around the city once I arrive in Serbia?
68,What are some unique experiences I can have during my trip to Nairobi?
68,What is the best time of the year to visit Nairobi?
68,What type of local food can I expect to find in Nairobi?
68,How can I get around Nairobi during my trip?
68,What type of language will I need to speak to communicate with locals in Nairobi?
69,What is the best time of year to visit Athens in terms of the weather?
69,What are some must-try dishes that can be found in the local cuisine of Athens?
69,Are there any museums in Athens that are popular among tourists?
69,What types of tours can I join to explore the historical side of Athens?
69,What are the different ways to move around the city in Athens?
70,What time of the year would be ideal for visiting Boston to avoid most harsh weather conditions?
70,What shoes should I wear to ensure a comfortable trip while walking in Boston?
70,What are some of the main local food dishes to try in Boston for an authentic dining experience?
70,"How can I get around Boston using public transportation, if I don't have a car?"
70,"Are there any historical sports gatherings I could attend, or are they mostly tours or exhibitions?"
71,What time of the year is the most recommended for visiting Prahy?
71,What is the name of the famous clock that a visitor should not miss in Prague?
71,What are some unique foods or drinks that one must try while in Prague?
71,What modes of public transportation are commonly available in Prague?
71,What cultural aspects can a visitor look forward to exploring while in Prague?
72,What should I prioritize to experience the Atomium to its fullest potential?
72,What time of year is recommended to travel to Brussels?
72,Can you tell me the location of Brussels using coordinates?
72,What type of food is special to the people of Brussels?
72,What transportation options can I find to get around Brussels?
73,What is unique about the beaches in this destination?
73,When is the most recommended time to experience the city's festivities?
73,Are there any popular cheese-based dishes in the local cuisine?
73,What are the available alternatives for getting around the city?
73,"What is the main event that attracts tourists to Rio, making the experience unforgettable?"
74,What activities can I do in Auckland that can get my adrenaline pumping?
74,What are some popular attractions I can visit on Waiheke Island in Auckland?
74,What types of cuisine should I expect to try during my visit to Auckland?
74,Can I get by without speaking the local language of Māori during my trip to Auckland?
74,Are there any options for exploring the city by public transportation or on foot?
75,"What are the coordinates of Seattle, and in which part of the world is it located?"
75,"What time of day is best to visit the Pike Place Market, and what is the market experience like?"
75,"What transportation options are available in Seattle, and which one is best for short trips?"
75,"What is the primary language spoken in Seattle, and what are the area's most notable cultural influences?"
75,What are the names of the two most famous attractions in Seattle that I shouldn't miss during my visit?
76,"What are the popular attractions that I can visit when I travel to Stockholm, Sweden?"
76,"Can you recommend the peak season of the year that I should consider when planning my trip to Stockholm, Sweden?"
76,"What forms of public transportation are available in Stockholm, Sweden, and should I consider for my travel?"
76,"What are some traditional local foods that I should try during my visit to Stockholm, Sweden?"
76,"What are the top cultural aspects that I should know before traveling to Stockholm, Sweden, to appreciate the local heritage?"
77,What is the best way to get a good view from Table Mountain in Cape Town?
77,"What are some local dishes I should try while visiting Cape Town, South Africa?"
77,When would be the best time for me to travel to Cape Town?
77,What is the primary way to travel to places of interest in Cape Town?
77,What kinds of activities can I do besides sightseeing in Cape Town?
78,What are the must-try dishes when visiting Manila?
78,What is the best way to experience the beautiful view of Manila Bay?
78,What are the most popular transportation options in Manila?
78,What time of year is recommended to visit Manila?
78,What are the historical significance and cultural heritage that I can experience in Manila?
79,What are the interesting historical sites in New Delhi that I shouldn't miss?
79,What months are recommended for visiting New Delhi considering the weather?
79,What transportation options are available in New Delhi if I prefer a ride with multiple people?
79,What local dishes should I try to experience the authentic taste of the area?
79,What languages can locals in New Delhi understand if I need to ask for directions?
80,"What is one place in Lagos, Nigeria that was positively reviewed by a user and what did they like about it?"
80,"What are two of the popular foods I can expect to eat during my visit to Lagos, Nigeria?"
80,"What modes of public transportation can I use to get around Lagos, Nigeria?"
80,"In what months is Lagos, Nigeria considered a good time to visit and why?"
80,"What are the names of a couple of the popular attractions that can be visited in Lagos, Nigeria?"
81,What is a must-visit market to experience the local culture in Cairo?
81,Can I walk safely in Cairo or are there other recommended modes of transportation?
81,What is a recommended period of the year to travel to Cairo for pleasant weather?
81,Are there any specific skills that would help me get good deals on souvenirs in Cairo?
81,What are the names of some popular local dishes I should try during my visit to Cairo?
82,What are some must-try local foods in Vancouver?
82,What modes of public transportation are available in Vancouver?
82,What time of the year is ideal for outdoor activities in Vancouver?
82,What languages are spoken by the locals in Vancouver?
82,What are some popular outdoor activities available in Vancouver?
83,What are some of the must-see attractions in Berlin that I shouldn't miss out on?
83,What are some local dishes that I should try while visiting Berlin?
83,How can I get around the city during my stay in Berlin?
83,What are some activities that I can do in Berlin at night?
83,What is the best time to plan a trip to Berlin to explore the city's attractions?
84,What is the name of the famous experience I have to try in Reykjavik?
84,How can I make sure I visit the Blue Lagoon during my trip to Reykjavik?
84,When can I best expect to see some unique landscapes and enjoy the natural beauty of Reykjavik?
84,What are some of the local Icelandic dishes I should try while visiting Reykjavik?
84,Are there good transportation options available once I reach Reykjavik?
85,What is the best way to explore the historic district of Athens?
85,What time of year is recommended to visit Athens?
85,What are some popular desserts that I should try while in Athens?
85,Are there any public transportation systems available in Athens?
85,What are some unique cultural experiences that I can participate in while in Athens?
86,"What is the most recommended time frame to plan a trip to Casablanca, Morocco?"
86,When is the best time to visit the Hassan II Mosque for optimal views?
86,What are the options for getting around the city of Casablanca?
86,What are the local must-try dishes that I should look out for in Casablanca?
86,What are the top attractions that showcase the rich heritage and cultural significance of Casablanca?
87,What is the best season to visit Kirov for outdoor activities?
87,Are there any must-visit cultural attractions that I should know about in Kirov?
87,"I'm interested in exploring local Russian dishes in Kirov, what are some of the highlights?"
87,Could you please provide me with information on the types of public transportation available in Kirov?
87,What are some of the natural attractions and scenic spots that I can explore in the Kirov region?
88,What are some popular things to do in Marrakech?
88,What are the must-try dishes in the local cuisine of Marrakech?
88,Where can I find unique souvenirs in Marrakech?
88,What is the recommended time of year to visit Marrakech?
88,What are some ways to experience the culture and history of Marrakech?
89,"What are some popular tourist attractions in the destination of Lima, Peru?"
89,When is it recommended to visit the city in terms of optimal weather conditions?
89,What are the primary methods of transportation available to travelers in Lima?
89,"What types of food are typically served in the local cuisine of the city of Lima, Peru?"
89,"What are some activities that can be done to experience the cultural scene in Lima, Peru?"
90,What are the must-visit places in Ankara that showcase the city's history?
90,What type of local food should I try when I'm in Ankara?
90,What are the best months to travel to Ankara in terms of weather?
90,How can I get around the city once I arrive in Ankara?
90,What kind of tours are available for those interested in learning about Ankara's past?
91,What is the suggested period to visit Manama in Bahrain for the best experience?
91,Are there any historical sites in Manama that are highly recommended by tourists?
91,What type of museum can be found near the Bahrain Fort in Manama?
91,What are the modes of public transportation available in Manama for getting around the city?
91,"In Manama, what are the traditional Arabian dishes that I should try during my visit?"
92,What are some must-try foods that are characteristic of the local cuisine during my trip?
92,I want to explore the city when the weather is warm. When is the recommended time to visit?
92,What types of public transportation are available to get me around the city?
92,What significant cultural practice or value is notable in the destination that I should be aware of?
92,What are some popular places to visit that can help me understand the city's history?
93,"What are the best months of the year to visit Helsinki, Finland?"
93,What are some must-visit attractions to explore in Helsinki?
93,Can you recommend some local dishes to try while I'm in Helsinki?
93,What is the primary language spoken by locals in Helsinki?
93,How can I get around the city while traveling in Helsinki?
94,Are there any good months to visit Cairo to avoid the heat?
94,"What are some traditional dishes to try while in Cairo, Egypt?"
94,"Can I get around Cairo using public transportation, and what options are available?"
94,What are the must-see historical sites in Cairo that I should prioritize visiting?
94,"What language do most locals in Cairo speak, in case I need to communicate with them?"
95,"What are the top months recommended to visit Hanoi, considering the best time to visit?"
95,Can you suggest any must-try local dishes when visiting Hanoi for the first time?
95,What are the popular options for getting around Hanoi once I arrive?
95,I've heard great things about the scenery in Hanoi - are there any notable attractions to check out near the city?
95,What are some unique aspects of Hanoi's culture that I should be aware of before my trip?
96,What time of the year is best for visiting Zanzibar?
96,Are there any notable cultural experiences offered in Zanzibar?
96,What are my options for traveling around Zanzibar?
96,What type of food can I expect to try in Zanzibar?
96,What is the most popular part of Zanzibar to explore?
97,What is the best way to explore Valletta in Malta?
97,When is the peak season for visiting Malta?
97,What are some unique dishes I can try while in Malta?
97,Can I get around Malta using buses and other transportation options?
97,What kind of cultural experiences can I expect to have in Malta?
98,"What time of the year is best for visiting Doha, Qatar to avoid extreme temperatures?"
98,"Are there any unique local dishes that I must try during my trip to Doha, Qatar?"
98,"I'm an art enthusiast, what are some must-visit attractions to explore in Doha, Qatar?"
98,"I'm traveling to Doha, Qatar for the first time and I don't speak Arabic, will I still be able to communicate with locals?"
98,"Are there any transportation options available in Doha, Qatar for tourists apart from driving?"
99,What are the must-see places to visit in Ankara?
99,What types of food are Ankara locals known for serving?
99,What time of the year is recommended for visiting Ankara?
99,How can I get around the city of Ankara?
99,What are some cultural activities available to experience in Ankara?
100,"What are some popular activities to do while visiting Qaqortoq, Greenland?"
100,What are some must-visit attractions to explore in Qaqortoq?
100,What types of local cuisine can I expect to find in Qaqortoq?
100,What are the best months to travel to Qaqortoq for optimal weather?
100,What languages are commonly spoken in Qaqortoq that I should be prepared to communicate in?
101,What are the most well-known historical sites I can visit in Luxembourg City?
101,What are the traditional dishes I should try when I visit the place?
101,Are there English guided cultural tours available in Luxembourg City?
101,What is the best mode of public transportation in Luxembourg City?
101,What are the coordinates that I should enter into my GPS device when driving to Luxembourg City?
102,In what months of the year is Quebec City most suitable for a visit?
102,What is a popular dish originating from Quebec City that I should try?
102,Are the locals in Quebec City able to communicate in English?
102,What are some ways I can get around Quebec City without a car?
102,Can I participate in cultural events while visiting Quebec City?
103,What time of the year should I plan my trip to experience the city's local culture?
103,Are there any unique art scenes in the city I should know about?
103,"Besides the English language, what languages can I expect to hear spoken by locals?"
103,What are some of the mainstream transport options available at my disposal?
103,Can you tell me some of the signature attractions the city of Yerevan has to offer?
104,"What are the best months to plan a trip to Lilongwe, Malawi?"
104,What can I expect from the local markets in terms of atmosphere?
104,What local food should I definitely try when visiting Lilongwe?
104,Are there any cultural activities or experiences available in Lilongwe?
104,"How can I get around Lilongwe, and what transportation options are available?"
105,"What is the best season to travel to Tbilisi, Georgia to experience the optimal weather?"
105,"What are the most famous traditional dishes in Tbilisi, Georgia?"
105,"What are some popular activities I can participate in when visiting Tbilisi, Georgia?"
105,"What type of public transportation can I use to get around Tbilisi, Georgia?"
105,"What are the names of two famous popular attractions I can visit in Tbilisi, Georgia?"
106,"What time of the year would be ideal for my trip to Hamilton, Canada?"
106,Could you please suggest some activities to enjoy in the outdoors during my visit to Hamilton?
106,What are some of the most iconic places that I should visit during my stay in Hamilton?
106,I'm thinking about trying some local food in Hamilton. What are some dishes I should not miss?
106,What transportation options do I have available to travel within Hamilton?
107,What are some must-visit places of interest in Riga that showcase the local culture?
107,What are some traditional dishes I should try while visiting Riga?
107,"Can I get around the city of Riga using public transportation, and if so, what options are available?"
107,What is the best time of the year to experience the full range of cultural events Riga has to offer?
107,What languages can I expect locals to speak when communicating with them in Riga?
108,What is the geographic location of Asuncion in terms of its coordinates?
108,What is the best way to get around Asuncion in terms of transportation?
108,What types of activities can I expect to enjoy in Asuncion?
108,What are some must-try local dishes I should eat while in Asuncion?
108,What time of the year is ideal to visit and experience Asuncion's vibrant nightlife?
109,What is the best time to visit Dhaka for a pleasant weather experience?
109,Can you recommend any must-try dishes at local eateries in Dhaka?
109,What types of transportation options are available in Dhaka for tourists?
109,What are some popular attractions to visit while exploring Dhaka?
109,What are the local languages spoken by the people of Dhaka that I should know?
110,What is the best time of the year to visit Lagos in Nigeria and what can I expect from the weather during that time?
110,"What kinds of local dishes should I definitely try during my trip to Lagos, Nigeria?"
110,"Are there any cultural festivals that I should not miss during my visit to Lagos, Nigeria?"
110,"Where can I check out live music and what kind of nightlife does Lagos, Nigeria offer?"
110,"What are some of the top attractions to visit in Lagos, Nigeria and what can I expect to see there?"
111,What are some popular dishes I should try while I'm in Stockholm?
111,Are there any popular cultural events I can participate in during my visit?
111,"How do I get around the city, and are there any options available for water travel?"
111,What time of year would you recommend visiting Stockholm for the best experience?
111,Are there any museums or historical sites I should consider visiting while in Stockholm?
112,What are some of the popular cultural festivals and events that I can experience when I visit Brussels?
112,Is there a special time in the year that is recommended to visit this destination?
112,What are some of the main language spoken by locals in Brussels?
112,"What kind of dining experience can I expect, and are there any local specialties I should try?"
112,Are there any specific shopping or scenic spots near popular attractions that I should be aware of?
113,Can I take a romantic walk on Charles Bridge without bumping into the crowds?
113,Are there historical guided tours available during early mornings in Prague?
113,What is the most ideal time of year for visiting tourist attractions such as Prague Castle?
113,"Is it convenient to explore Old Town Square on foot, or are there other forms of transportation available?"
113,Are there any local foods similar to pastries or desserts that I should try while visiting Prague?
114,What is the location of Copenhagen in terms of coordinates?
114,What are some of the popular foods to try when visiting Copenhagen?
114,What are some popular attractions to check out in Copenhagen?
114,What time of the year would be best to plan a visit to Copenhagen?
114,What mode of transportation options are available in Copenhagen?
115,What is the best way to see wildlife at Nairobi National Park?
115,"What local dishes should I try during my trip to Nairobi, Kenya?"
115,Can you recommend any popular wildlife sanctuaries I can visit in Nairobi?
115,What are the most commonly used modes of transportation in Nairobi?
115,"What months of the year have the best climate for visiting Nairobi, Kenya?"
116,What are some of the must-try food items I should look out for when I'm in Melbourne?
116,What are the best months of the year to plan my trip to Melbourne?
116,What are some popular modes of transportation that I can use to get around Melbourne?
116,What are some of the top cultural events and exhibitions that I can participate in or attend in Melbourne?
116,What are some of the notable locations in Melbourne that I should prioritize when planning my itinerary?
117,What are the local transportation options to get around in Mumbai?
117,What time of year is recommended to visit Mumbai for favorable weather?
117,Are there English speakers available in Mumbai to assist tourists?
117,What are some popular historical sites to visit in Mumbai?
117,What are some local Mumbai street foods that I should try during my visit?
118,What is a must-visit place in Los Angeles for those who love watching movies?
118,What time of the year is ideal for traveling to Los Angeles?
118,What modes of transportation are available to get around Los Angeles?
118,What is special about the cultural scene in Los Angeles?
118,What are some popular types of food I should try when visiting Los Angeles?
119,What are the best months to plan a trip to Mexico City?
119,Are there any notable transportation options available in Mexico City?
119,What are some cultural highlights to explore in Mexico City?
119,Can you recommend some popular sites to visit during my trip to Mexico City?
119,What kind of local culinary experiences should I expect while visiting Mexico City?
120,What are the popular transportation methods to get around in the destination I'm planning to visit in Vietnam?
120,"I want to try some local dishes during my trip, what are some recommended local cuisines that I shouldn't miss in the city?"
120,What's the best time frame to travel to this destination to avoid bad weather and have a comfortable trip?
120,"I'm interested in learning about the cultural significance of the destination, can you tell me more about its historical importance?"
120,"I heard that there's a famous market in the city, can you recommend a specific market to visit for local crafts and shopping?"
121,"What is the best time of the year to plan a trip to Cape Town, South Africa?"
121,What are some must-try local dishes when visiting Cape Town?
121,Are there any cultural events or festivals that I can attend during my stay in Cape Town?
121,How can I get around the city once I arrive in Cape Town?
121,What are some of the unique natural features or landmarks that I should not miss when visiting Cape Town?
122,What are some local dishes that I should try during my trip to Singapore?
122,Can you provide me with the geographical coordinates of Singapore?
122,What is the primary attraction in Singapore that features a unique blend of modern architecture and natural beauty?
122,How can I get around Singapore without a car?
122,What time of the year should I avoid visiting Singapore due to potential weather issues?
123,What is the most convenient way to get around Bogota?
123,Can you recommend the top dishes I should try when visiting Bogota?
123,What are the must-see places for outdoor activities and cultural exploration in Bogota?
123,What is the recommended time to plan my trip to Bogota to experience local events?
123,What language should I expect to use during my interactions with locals in Bogota?
124,What are the must-visit historical sites in Tunis?
124,What months of the year are ideal for traveling to Tunis?
124,Are there any local modes of public transportation in Tunis for tourists?
124,What are the native languages spoken by the people of Tunis?
124,What are the most famous local dishes to try while visiting Tunis?
125,"What is the best time to visit Seoul, South Korea?"
125,What are the local cuisine highlights to try while in Seoul?
125,What transportation options are available in Seoul?
125,What are some popular cultural activities to do in Seoul?
125,During what months can I catch the changing of the guard ceremony at Gyeongbokgung Palace?
126,What time of the year is best to visit Abidjan?
126,What are some must-try local dishes when visiting Abidjan?
126,What are the popular transportation options available in Abidjan?
126,What are some unique cultural experiences I can explore in Abidjan?
126,Are there any beaches or coastal activities that I shouldn't miss when visiting Abidjan?
127,What is the best time to visit Manama in Bahrain to avoid the heat?
127,How would you describe the local cuisine in terms of must-try dishes?
127,What are some popular historical sites that I should consider visiting in Manama?
127,"I plan to explore the city, what are my options for public transportation in Manama?"
127,What cultural experiences should I look out for to get a sense of the modern and traditional aspects of Manama?
128,What is the best time of the year to visit Quebec City in Canada for the best experience?
128,"How can I travel to Quebec City using public transportation, and what options are available?"
128,"I am planning to visit Quebec City in Canada, what are the must-see attractions I should consider?"
128,What unique cultural events can I participate in during my trip to Quebec City in Canada?
128,What type of food can I expect to taste during my visit to Quebec City in Canada?
129,"What are some local dishes I should try during my visit to Auckland, New Zealand?"
129,I'm planning to visit Auckland and I'm interested in trying adventure sports. What time of the year would be best to visit?
129,"What are some of the most popular places I can visit in Auckland, New Zealand?"
129,What are some of the unique cultural highlights that Auckland has to offer?
129,"What are the common modes of public transportation in Auckland, New Zealand?"
130,What type of vehicles are commonly associated with the city of Havana?
130,What are the recommended months to plan a trip to Havana?
130,What types of transportation services are available to get around the city?
