id,question
1,What are some of the must-visit museums in Paris that house famous works of art?
1,Is it more convenient to explore Paris on foot or rely on public transportation?
1,Are there specific seasons or months when the city's scenery is particularly beautiful?
1,What are some sweet and delicious treats that I should try when visiting Paris?
1,What are some tips for getting a good view of the city from a high vantage point?
2,What are the geographical coordinates of the destination I am planning to visit?
2,Can you recommend the best months of the year to travel to my destination?
2,What are the options I have for getting around my destination?
2,What are the must-try foods when I visit my destination?
2,What are some popular cultural attractions I should not miss when visiting my destination?
3,"What are some great activities to do in the city, besides visiting popular attractions?"
3,How can I efficiently explore Central Park during my visit?
3,What can I expect the scenery to be like when visiting during the best times of the year?
3,Are there any must-try foods or desserts that are native to the local cuisine?
3,What options are available for me to get around the city without a rental car?
4,"What should I do to avoid the crowds at The Colosseum in Rome, Italy?"
4,"When is the most ideal period to visit Rome, Italy and why?"
4,"What local Italian dishes should I try when visiting Rome, Italy?"
4,"What type of cultural heritage can I expect to experience in Rome, Italy?"
4,"What options do I have for getting around Rome, Italy during my trip?"
5,What is the best way to experience Table Mountain if I don't have a lot of time?
5,"What are some must-try foods when visiting Cape Town, South Africa?"
5,Can you recommend some activities to do in Cape Town aside from visiting popular attractions?
5,What time of the year would be ideal to visit Cape Town if I want to make the most of my trip?
5,Are there any alternative ways to get around the city aside from driving a car?
6,What are the popular attractions I can visit during my trip to Sydney?
6,Are there any cultural festivals or events held in Sydney during the month of January?
6,Is surfing available as an activity option throughout the year in Sydney?
6,How do I travel from one place to another in Sydney?
6,What are some popular Australian dishes I need to try when I visit Sydney?
7,Could you please share some popular attractions I can visit in Barcelona?
7,What are some recommended times to plan my visit to Barcelona for optimal experience?
7,"I would like to try some local food, could you tell me a bit about Barcelona's local cuisine highlights?"
7,How do I get around the city without any hassle?
7,Are there any recommended activities I need to try during my stay in Barcelona?
8,What time of day is recommended to visit popular attractions in Istanbul for a more peaceful experience?
8,"I am planning to visit Istanbul in November, is this a good time to go?"
8,What types of activities can I enjoy on the Bosphorus while in Istanbul?
8,What are some local foods that I should try while traveling in Istanbul?
8,What forms of transportation are available in Istanbul for getting around the city?
9,What is the name of the popular dish made from stir-fried rice noodles that I can try in Bangkok?
9,What time of the year is best suited for visiting Bangkok in terms of weather and other conditions?
9,How can I stay safe from waterborne diseases when I am traveling to Bangkok?
9,What are the main transportation options that I can use to get around the city when I am in Bangkok?
9,What are the must-visit attractions that I should include in my itinerary when I am traveling to Bangkok?
10,"What is the best time of the year to experience Carnival in Rio de Janeiro, Brazil?"
10,"I'm looking for local restaurants in Rio, can you name some traditional Brazilian food I should try?"
10,"I want to explore Rio without getting lost, what transportation options are recommended for tourists?"
10,Are there any fun and unique activities I can participate in during my trip to Rio?
10,"What language do locals speak in Rio de Janeiro, should I learn some key phrases before my trip?"
11,What month range is ideal for visiting London?
11,How do you recommend planning a day at the British Museum?
11,What are some of the highlights of England's diverse cultural heritage in London?
11,Are there any unique meal options that one should try while in London?
11,What are some of England's most popular attractions that are accessible by walking in London?
12,"What are some popular dishes I should try when visiting Berlin, Germany?"
12,What type of transportation options are available for getting around Berlin?
12,What are some must-see attractions in Berlin that I shouldn't miss?
12,What months are ideal for visiting Berlin to enjoy pleasant weather?
12,What unique experiences or activities are available to explore Berlin's culture?
13,"What time of the year is best suited for visiting Madrid, Spain?"
13,Are there any specific local delicacies that I should try during my visit?
13,What are some of the most famous museums in Madrid that I shouldn't miss?
13,What are some of the public transportation options available in Madrid?
13,Are there any cultural performances or shows that I can attend during my visit?
14,What are the best months to visit Singapore for favorable weather?
14,What time of day is recommended to visit Gardens by the Bay?
14,What types of public transportation are available in Singapore?
14,What are the names of two popular local dishes to try in Singapore?
14,What are the names of the two official languages spoken in Singapore?
15,What are some must-try local dishes when visiting Cairo?
15,Are there any tips for getting the most out of my visit to the pyramids in Cairo?
15,What are the primary languages spoken by the locals in Cairo?
15,What is the best way to travel around the city of Cairo?
15,What time of the year is recommended for visiting Cairo?
16,"What are the must-visit places for nature lovers in Bangalore, India?"
16,Are there any specific instructions for visiting Lalbagh in Bangalore?
16,Which months of the year offer the best weather conditions for a visit to Bangalore?
16,Is there any local public transportation available for tourists in Bangalore?
16,What local delicacies should I try when I am in Bangalore?
17,What are the local specialties I should try when I visit Seoul?
17,What is the recommended duration for visiting Gyeongbokgung Palace in Seoul?
17,What are the major attractions I can visit in Seoul apart from Gyeongbokgung Palace?
17,"How do I navigate the city of Seoul, are there English-speaking taxi drivers?"
17,What type of activities can I take part in to experience the culture of Seoul?
18,What are some popular things to see and do while visiting Amsterdam?
18,Can I easily walk around the city or are there other forms of transportation available?
18,"What food should I try while in Amsterdam, the Netherlands?"
18,What months are generally considered the best time to plan a trip to Amsterdam?
18,Are there any unique ways to experience the city's scenery that I should consider?
19,What time of the year is ideal for visiting Buenos Aires?
19,Can you recommend some popular places to visit in Buenos Aires?
19,How can I experience the authentic local culture in Buenos Aires?
19,Are there any traditional dance lessons available in Buenos Aires?
19,What are some must-try dishes when visiting Buenos Aires?
20,What is a fun way to get around Lisbon?
20,What tram route would you recommend for scenic views?
20,When is the best time to visit Lisbon for good weather?
20,What are some must try local dishes when visiting Lisbon?
20,What are some popular attractions near the city center of Lisbon?
21,What is the best time to visit Prague in order to fully enjoy the city's attractions?
21,What are some of the must-try dishes when visiting Prague?
21,What makes Charles Bridge a unique and unmissable attraction?
21,How can we get around the city of Prague to explore its many attractions?
21,What are some popular events or activities that can be enjoyed on the rivers of Prague?
22,"What time of year is considered best to plan a trip to Moscow, Russia?"
22,What modes of public transportation are available for getting around the city of Moscow?
22,Are there any historical landmarks to see while visiting Moscow?
22,What local Russian dishes should I try during my visit to Moscow?
22,What activities can I expect to experience during my visit to Moscow?
23,What are some must-try foods when I visit the city?
23,"I'll be visiting in October, is that a good time?"
23,How can I get around the city using public transport?
23,What are some unique cultural experiences I can expect to have?
23,Are there any beautiful scenic spots to watch the sunset in the city?
24,What are the GPS coordinates of Auckland for planning my itinerary?
24,"What local foods should I try during my trip to Auckland, New Zealand?"
24,What are the recommended activities I can enjoy in Auckland?
24,Which options do I have for traveling around Auckland?
24,What type of attractions can I expect to see on Waiheke Island near Auckland city?
25,What is the most ideal period to visit Honolulu to avoid the crowds?
25,Can I walk around the popular tourist spots in Honolulu or are there other options available?
25,What are the ocean activities I can enjoy in Honolulu?
25,Are there any recommended sunrise spots in Honolulu that I shouldn't miss?
25,What type of cuisine can I expect to find in the local restaurants of Honolulu?
26,What are some must-visit attractions in Mumbai?
26,How can I get around the city while I'm visiting?
26,What local dishes should I try while in Mumbai?
26,At what time of day would be best to take a photo at the Gateway of India?
26,What are some unique experiences I can have in Mumbai?
27,"What type of cuisine can I expect to find when visiting Johannesburg, South Africa?"
27,What months of the year provide the best time to visit Johannesburg?
27,What language options are available for tourists in Johannesburg?
27,What type of activities can I participate in while visiting Johannesburg?
27,What are some popular local attractions I should consider visiting in Johannesburg?
28,"What are some popular attractions to visit in Copenhagen, Denmark?"
28,What type of activities can I expect to find in the city?
28,"What is the local cuisine in Copenhagen, and what dishes should I try?"
28,What is the best time to visit Copenhagen to get the most out of my trip?
28,What are the most common transportation options available in Copenhagen?
29,What time of the year is it best to visit this destination to enjoy the city's festivities and pleasant weather?
29,What are some of the must-try dishes I should order when I visit this destination?
29,Where can I find unique shopping experiences and local goods during my stay?
29,What type of transportation can I use to travel across the city efficiently?
29,What type of cultural experiences and historical landmarks can I expect to find when I visit this destination?
30,What is the recommended time of year to visit Oslo?
30,What modes of public transportation are available in Oslo?
30,What are some popular outdoor activities available in Oslo?
30,What are the top recommendations for must-see places in Oslo?
30,What local foods should I try while visiting Oslo?
31,What are the must-visit attractions in Dubai and what is the recommended transport to get there?
31,What are the most recommended dishes to try during a visit to Dubai?
31,What is the best time of the year to visit Dubai and why?
31,"What are the top activities to experience in Dubai, other than visiting the famous landmarks?"
31,What languages are predominantly spoken in Dubai and are there any cultural events not to be missed?
32,What are the best months to visit the destination I'm traveling to?
32,Is there a specific traditional local dish I should try while I'm in Shanghai?
32,Are there any scenic nighttime spots I should check out in the city?
32,What type of transportation options will be available to me in Shanghai?
32,Can I get by with only speaking English during my trip?
33,What are the high points of local food to experience when visiting Melbourne?
33,Is English the primary language used by locals in Melbourne?
33,What are some ways to get around the city of Melbourne?
33,What types of exciting activities can be done in Melbourne?
33,What are some must-visit sites to see in Melbourne?
34,What is the best method to fully appreciate the historic center in Quito?
34,What months are recommended to travel to Quito to enjoy favorable weather?
34,Where can I find the typical llapingachos dishes when I visit Quito?
34,How do I best get around Quito to explore its cultural heritage without a car?
34,What should I expect from the local festivals celebrating Andean culture in Quito?
35,What are some recommended times for going on a wildlife safari in Nairobi?
35,Can I use the local public transportation options to get to the popular attractions?
35,What time of the year should I visit Nairobi to avoid the rainy season?
35,Are there any conservation efforts supported by popular attractions in Nairobi?
35,Can I get by with just speaking English during my trip to Nairobi?
36,"What are the top recommended dishes to try when visiting Reykjavik, Iceland?"
36,What mode of transportation is most convenient for getting around in Reykjavik?
36,"What are the must-see attractions in Reykjavik, Iceland?"
36,"What are some unique activities that can be done in Reykjavik, Iceland?"
36,"What is the best time of the year to experience the Northern Lights in Reykjavik, Iceland?"
37,What time of the year would be ideal to visit Manila in terms of weather?
37,What is the mode of public transportation that one can commonly use to get around Manila?
37,"I'm looking forward to trying Filipino food, what local dishes should I not miss?"
37,What is the historical site where I can appreciate the ancient architecture in Manila?
37,What are some activities available that would help me learn more about the city's rich history?
38,What time of day do you recommend visiting the rice terraces in Bali to get the best photos?
38,"I am traveling to Bali in March, should I consider rescheduling my trip to experience the best weather?"
38,What types of transportation can I use to get to Ubud Monkey Forest from my hotel?
38,Are there any popular local dishes in Bali that I should try while I'm there?
38,What are some popular activities I can participate in that allow me to connect with Bali's spiritual side?
39,"What are some must-try dishes when visiting Moscow, Russia?"
39,"Which time of the year is ideal to plan a trip to Moscow, Russia?"
39,"What are the most convenient modes of transportation to get around Moscow, Russia?"
39,How can I gain a deeper understanding of Moscow's historical buildings?
39,What makes Moscow's art scene so unique and worth exploring?
40,What is the best way to get a deeper understanding of the pyramids and historical sites in Cairo?
40,What are some popular attractions in Cairo that are a must visit?
40,I am planning a trip to Cairo and would like to know what is the best time to visit the city.
40,Can you please suggest some local cuisine that I should try when visiting Cairo?
40,I'm planning to travel to Cairo. What method of transport is available to get around the city?
41,What are some of the top attractions I can visit in Casablanca?
41,What are some of the cultural highlights that I can experience in Casablanca?
41,What is the best way for me to get around the city of Casablanca?
41,What are some of the local dishes that I should try while I'm in Casablanca?
41,What are the most ideal months to plan a trip to Casablanca?
42,What are the local specialties I should try when visiting Abu Dhabi?
42,What is the best time of day to view the Sheikh Zayed Mosque?
42,What kind of transportation options will I have in Abu Dhabi?
42,What are some popular attractions I should visit in Abu Dhabi?
42,What type of activities can I experience in Abu Dhabi?
43,What is the best time of the year to plan a trip to Copenhagen for a great experience?
43,What are some popular Danish dishes that I should try when I visit Copenhagen?
43,What are some attractions that I shouldn't miss when I visit Copenhagen city?
43,Are there any alternative transportation options in Copenhagen besides walking?
43,"What is the local language spoken in Copenhagen, and is it useful for tourists to learn?"
44,What is the most recommended time to visit to make the most out of the trip to Naples?
44,What are some of the top must-try dishes when visiting Naples?
44,Are there any specific sites near Naples that are famous for their historical significance?
44,What are the main options for getting around the city of Naples?
44,What are some of the local cultural practices that make Naples unique?
45,"What are some must-try local foods when visiting Stockholm, Sweden?"
45,How much time is recommended for exploring the Vasa Museum?
45,What language should I prepare to communicate with locals during my trip to Stockholm?
45,Which months are ideal for planning a trip to Stockholm for the best experience?
45,Are there any scenic and historic districts worth exploring during my visit to Stockholm?
46,What is the user's opinion about the thermal baths in Budapest?
46,What is the most recommended thermal bath for a unique experience in Budapest?
46,What time of the year is the most suitable for visiting Budapest?
46,What are some popular dishes in the local cuisine of Budapest that I should try?
46,What are some of the popular transportation options I can use to get around Budapest?
47,"What are some must-try dishes I should experience during my trip to Lima, Peru?"
47,Are there any cultural events that I can participate in during my visit to Lima?
47,What modes of transportation can I use to get around Lima?
47,"What are the geographical coordinates of Lima, Peru?"
47,"I'm planning to visit Machu Picchu, what time of the year would be the best to visit?"
48,What is the best time to plan a visit to Kuwait City to avoid the hot summer?
48,"Are there any historic sites near the location coordinates 29.3759° N, 47.9774° E that are famous for their sunset views?"
48,"Apart from the usual sightseeing activities, what adventures can I enjoy in Kuwait City?"
48,"What traditional Kuwaiti dishes should I try while I am there, and where can I sample them?"
48,What are some popular forms of public or private transportation available to tourists in Kuwait City?
49,What is the best time to travel to Dar Es Salaam for good weather and pleasant experience?
49,Can you tell me about some of the traditional Tanzanian dishes that I can try in Dar Es Salaam?
49,Which popular transportation options can I use to get around the city of Dar Es Salaam?
49,I am interested in exploring the cultural highlights of Dar Es Salaam. Can you suggest some attractions to visit?
49,What are some recommended activities available for beach lovers like me in the Dar Es Salaam area?
50,What are some of the main local dishes I should try when visiting Abidjan?
50,What are the names of some popular attractions to visit in Abidjan?
50,What modes of public transportation are available to get around Abidjan?
50,What is the best time of the year to plan a visit to Abidjan?
50,What are some typical cultural events I can experience during my visit to Abidjan?
51,What are some popular attractions that I should not miss in Montevideo?
51,What types of food and drinks are typically served in local Uruguayan restaurants?
51,"I am planning a trip to Montevideo, is the city safe to explore on foot?"
51,What is the best time of the year to plan my vacation in Montevideo?
51,What activities can I do to experience the culture and history of Montevideo?
52,"What are some popular places I should visit when I travel to La Paz, Bolivia?"
52,What kind of local foods should I expect to find during my visit to La Paz?
52,What is the best way to get around La Paz when I'm there?
52,What are the cultural highlights that I should experience while in La Paz?
52,When is the optimal time of year to travel to La Paz for the best views?
53,"What local dishes should I definitely try when visiting Maputo, Mozambique?"
53,"What are some of the top attractions to check out in Maputo, Mozambique?"
53,What kinds of tours can I go on to learn more about the city and its culture?
53,"Which months are best for a trip to Maputo, Mozambique?"
53,"What are some common modes of transport to get around Maputo, Mozambique?"
54,"What are the UNESCO World Heritage Sites I can visit in Tunis, Tunisia?"
54,"Can you provide me with a travel tip to make the most of my time in Tunis, Tunisia?"
54,"What is the best time of the year for visiting Tunis, Tunisia if I want to avoid extreme temperatures?"
54,"How do I get around the city using public transportation while in Tunis, Tunisia?"
54,"What are the must-try dishes I should experience while sampling the local cuisine in Tunis, Tunisia?"
55,What are the best months to travel to this destination for ideal safari and cultural experiences?
55,What mode of local transportation is recommended for traveling within the city?
55,What are some of the local dishes available for tourists to try during their trip?
55,What times of the day are most suitable for planning a wildlife safari in this destination?
55,What local organizations or attractions in this destination are committed to wildlife conservation and how can tourists get involved?
56,"What are some must-try dishes when visiting the local restaurants in Nassau, Bahamas?"
56,"Are there any seasonal periods recommended for traveling to Nassau, Bahamas?"
56,"Can you recommend any popular activities for adventurous travelers in Nassau, Bahamas?"
56,"What is the primary mode of public transportation used by locals in Nassau, Bahamas?"
56,"What languages are commonly spoken by the locals in Nassau, Bahamas that a traveler could use during their trip?"
57,"What is the location of Cartagena, Colombia in terms of latitude and longitude?"
57,"When is the recommended time of the year to travel to Cartagena, Colombia?"
57,"What types of activities can I participate in during my stay in Cartagena, Colombia?"
57,What local Colombian dishes should I try while I'm in Cartagena?
57,"What method of transportation would you recommend for exploring Cartagena, Colombia?"
58,"What are some popular local dishes I should try while visiting Tbilisi, Georgia?"
58,What's the best way to get around the city once I arrive in Tbilisi?
58,What are some popular attractions in Tbilisi that I shouldn't miss?
58,Is there a specific time of the year that is recommended to visit Tbilisi?
58,What's a local product or activity that I should definitely try when visiting the region of Tbilisi?
59,"What are some local food options that I should try while visiting Harare, Zimbabwe?"
59,What time of year is best to plan a trip to Harare?
59,Are there any nearby outdoor attractions for me to enjoy nature walks in Harare?
59,"What type of transportation can I expect to find in Harare, Zimbabwe?"
59,What are some popular attractions to visit outside of the city center in Harare?
60,What are some famous attractions I shouldn't miss when I visit Accra?
60,Are there any traditional dishes that I should try while in Accra?
60,What is the best time of year to plan my trip to Accra for the best experience?
60,Are there public transportation options available for people to get around Accra?
60,What can I expect from the local events in Accra during my stay?
61,What is the ideal time of day to visit Marina Beach in Chennai to enjoy pleasant weather?
61,What are some of the most well-known local dishes I should try during my visit to Chennai?
61,I will be visiting Chennai in March; will I still be able to enjoy my trip or would it be better to go another time?
61,Are there any culturally or historically significant sites or landmarks in Chennai that are a must-visit?
61,What forms of public transportation can I use to get around the city of Chennai during my visit?
62,"What is the local cuisine like in Zanzibar, Tanzania?"
62,Can you recommend any specific attractions in Zanzibar that showcase its history and culture?
62,"Is Stone Town worth visiting, and what are some must-see places within it?"
62,What are the primary modes of public transportation available in Zanzibar?
62,What are the recommended months to visit Zanzibar for ideal weather conditions?
63,What are the exact geographical coordinates for Bermuda that I can enter into my GPS?
63,Can you tell me the most recommended time of the year to visit Bermuda in terms of events and overall experience?
63,What are some unique local dishes I can expect to enjoy during my stay in Bermuda?
63,Are there any essential precautionary measures or basic safety guidelines for visitors exploring the caves in Bermuda?
63,What is the primary mode of public transportation that visitors typically use to get around the island?
64,"What are the best times to plan my trip to San Jose, Costa Rica?"
64,"What are some local dishes that I should try while visiting San Jose, Costa Rica?"
64,"How can I get around San Jose, Costa Rica once I arrive?"
64,Are there specific events or festivals I can participate in during my trip?
64,"What are some popular places to visit during my stay in San Jose, Costa Rica?"
65,What is a must-visit place in Skopje's Old Bazaar area?
65,"What months are advised for traveling to Skopje, North Macedonia?"
65,What is a recommended dish to try at local restaurants in Skopje?
65,"How can I get around the city of Skopje, North Macedonia?"
65,What type of activities and attractions can I expect to find in Skopje?
66,What are some popular attractions in the area that I shouldn't miss during my trip?
